{
  "evidence_id": "EV-KA-BIRTH-001",
  "source_url": "https://crsorgi.gov.in/",
  "source_title": "Civil Registration System - Section 13 (Current)",
  "source_type": "GOVERNMENT_PORTAL",
  "date_accessed": "2026-09-26",
  "jurisdiction": "Karnataka",
  "service": "birth_certificate",
  "issuing_authority": "Registrar General of India / CRS",
  "exact_supported_claim": "Delayed registration of birth > 30 days and <= 1 year requires written permission of the Tahsildar or Commissioner/Chief Officer of the Municipality and a late fee.",
  "conflicts_with": []
}