{
  "evidence_id": "EV-KA-DEATH-004",
  "source_url": "https://sakala.karnataka.gov.in/",
  "source_title": "Sakala Services - Death Certificate Processing Time",
  "source_type": "GOVERNMENT_PORTAL",
  "date_accessed": "2026-09-26",
  "jurisdiction": "Karnataka",
  "service": "death_certificate",
  "issuing_authority": "Revenue Department / Health Department",
  "exact_supported_claim": "Processing time for Death Certificate applications under Sakala is typically up to 21 working days.",
  "conflicts_with": []
}