{
  "evidence_id": "EV-KA-INC-001",
  "source_url": "https://nadakacheri.karnataka.gov.in/",
  "source_title": "Nadakacheri / AJSK - Income Certificate Fee",
  "source_type": "GOVERNMENT_PORTAL",
  "date_accessed": "2026-09-26",
  "jurisdiction": "Karnataka",
  "service": "income_certificate",
  "issuing_authority": "Revenue Department, Government of Karnataka",
  "exact_supported_claim": "The application fee for an Income Certificate is Rs. 15 through the Nadakacheri portal.",
  "conflicts_with": []
}