{
  "evidence_id": "EV-KA-CASTE-006",
  "source_url": "https://nadakacheri.karnataka.gov.in/",
  "source_title": "Revenue Department - Caste Certificate Officer Workflow",
  "source_type": "GOVERNMENT_PORTAL",
  "date_accessed": "2026-09-26",
  "jurisdiction": "Karnataka",
  "service": "caste_certificate",
  "issuing_authority": "Revenue Department",
  "exact_supported_claim": "Verification by Village Accountant. Issuing and approving authority is Tahsildar.",
  "conflicts_with": []
}