{
  "evidence_id": "EV-KA-BIRTH-006",
  "source_url": "https://sakala.karnataka.gov.in/",
  "source_title": "Sakala Services - Birth Certificate Processing Time",
  "source_type": "GOVERNMENT_PORTAL",
  "date_accessed": "2026-09-26",
  "jurisdiction": "Karnataka",
  "service": "birth_certificate",
  "issuing_authority": "Revenue Department / Health Department",
  "exact_supported_claim": "Processing time for applications requiring processing (delayed/new) is up to 21 working days.",
  "conflicts_with": []
}