{
  "evidence_id": "EV-KA-INC-004",
  "source_url": "https://sevasindhu.karnataka.gov.in/",
  "source_title": "Nadakacheri Portal - Income Certificate Requirements",
  "source_type": "GOVERNMENT_PORTAL",
  "date_accessed": "2026-09-26",
  "jurisdiction": "Karnataka",
  "service": "income_certificate",
  "issuing_authority": "Revenue Department, Government of Karnataka",
  "exact_supported_claim": "Income Proof is required. Accepted documents include Salary Slip, Form 16, Employer Certificate, IT Return, Pension Proof, or Latest Bank Statement.",
  "conflicts_with": []
}