{
  "evidence_id": "EV-KA-CASTE-005",
  "source_url": "https://sakala.karnataka.gov.in/",
  "source_title": "Sakala Services - Caste Certificate Processing Time",
  "source_type": "GOVERNMENT_PORTAL",
  "date_accessed": "2026-09-26",
  "jurisdiction": "Karnataka",
  "service": "caste_certificate",
  "issuing_authority": "Revenue Department",
  "exact_supported_claim": "Processing time is 21 days under Sakala.",
  "conflicts_with": []
}