{
  "evidence_id": "EV-KA-BIRTH-004",
  "source_url": "https://crsorgi.gov.in/",
  "source_title": "Civil Registration System - Normal Registration",
  "source_type": "GOVERNMENT_PORTAL",
  "date_accessed": "2026-09-26",
  "jurisdiction": "Karnataka",
  "service": "birth_certificate",
  "issuing_authority": "Registrar General of India / CRS",
  "exact_supported_claim": "Normal registration within 21 days is free.",
  "conflicts_with": []
}