{
  "evidence_id": "EV-KA-INC-007",
  "source_url": "https://nadakacheri.karnataka.gov.in/",
  "source_title": "Revenue Department - Income Certificate Officer Workflow",
  "source_type": "GOVERNMENT_PORTAL",
  "date_accessed": "2026-09-26",
  "jurisdiction": "Karnataka",
  "service": "income_certificate",
  "issuing_authority": "Revenue Department",
  "exact_supported_claim": "Verification by Village Administrative Officer/Village Accountant. Approving and Issuing by Tahsildar. Appeal to Assistant Commissioner.",
  "conflicts_with": []
}